,Title,Course,Task2.1,Post_text,Categories,Instr_text
136,The Philosophy of Andy Warhol (From A to B and Back Again),warhol-001,"2,3.","See Extract One in Week Two. I believe this tracks a simple arithmetic logic, but uses a discussion of sex to do so. It is about working a series of a, b logic statements but seeing if it can be made more meaningful to the reader by using attitudes to sex, and then men and women as the a and b variables. 
That book (great title!) is amazing and warholian in the sense that is all very contradictory: logical in its illogical premises, shallow and, because of that, full of deep insights, playful and serious. And it works. I think pop is that: when Nik Cohn talked about pop music he said that sanity and sense killed it. Could this be also applied to pop art? 
With regard to The [so called] Philosophy of Andy Warhol... In March 1974 Andy Warhol signed two book contracts with Harcourt Brace Jovanovich. One contract was for what would become The Philosophy of Andy Warhol (From A to B and Back Again) and the other for a book that Andy planned to do on PAULETTE GODDARD's life. Warhol agreed to give BOB COLACELLO half of the $35,000 advance to ""get him going"" on the proposal and outline. The books were to be titled The and Her (""and if and when Andy did an autobiography, that would be called Me"", according to Colacello). (BC207) The Paulette Goddard book never materialised (she wasn't very forthcoming with Hollywood gossip) and Pat Hackett ended up writing much of the Philosophy book. Bob Colacello gave her half of his advance. According to Colacello, Andy ""absolutely refused to consider"" giving Hackett a percentage of the book's future income and also ""gave her a curt turnoff"" when she asked for a credit - a byline - on the book. (BC208) Pat Hackett: ""On the first book, The Philosophy of Andy Warhol (From A to B and Back Again), I did eight separate interviews with Andy on the basis of which I wrote chapters 1 through 8 and chapter 10. Then, using material from conversations Andy had taped between himself and Bob Colacello and Brigid Berlin, I wrote the introductory chapter and chapters 9, 11, 12, 13 and 14. It was the first major project Andy and I had worked on together, and after the book was published, in 1975, he asked to co-author the second book with him - his memoirs of the sixties, which we decided to call Popism."" (AWDXV) Bob Colacello: ""I hadn't fully comprehended what I'd gotten myself into by ghostwriting the [Philosophy] book, until Andy was photographed for the cover of New York magazine, which had bought the first serial rights. They posed him in a closet, sitting at a typewriter, under a headline that read: 'Andy Warhol's Greatest Secret: He Likes to Write.' It finally hit me then - I was part of a big lie, and while it had lined my pockets, it robbed my ego of any hope of recognition. Pat Hackett probably felt even more ripped off: Nine chapters were wholly hers; four were mostly mine; one, 'The Tingle,' was Brigid's, and all three of us had worked on the prologue."" (BC309) From... http://www.warholstars.org/chron/philosophy.html 


 There was a recent panel discussion on YouTube between Bob Colacello, Brigid Berlin, and Vincent Fremont on Andy Warhol during which they shared, among other stories, anecdotes about how Bob Colacello would get stoned and ""channel"" the voice and philosophy of Andy Warhol while Brigid Berlin took dictation and helped keep Colacello in character. Bob Colacello was Andy Warhol's social collaborator, photographer, and travel companion, as well as editor of Warhol's Interview magazine for twelve years between 1970 and 1982. Brigid Berlin was one of Andy Warhol's ""Superstars"" and appeared in numerous Warhol films including ""Chelsea Girls"" in 1966 and ""Ciao! Manhattan"" in 1972 before working full time as a transcriptionist at Interview magazine from 1975 to beyond Warhol's death in 1987. Vincent Fremont has been working for Warhol since 1969 and was a central contributor to Warhol's film, television, and video forays before serving as vice president of Andy Warhol Enterprises and as one of the named founding members of the Andy Warhol Foundation for the Visual Arts as laid out in Warhol's last will & testament. Until the dissolution in October 2011 of the Andy Warhol Art Authentication Board to which he also consulted, Vincent Fremont held a lucrative position as the sole sales agent for artworks in the possession of the Andy Warhol Foundation for the Visual Arts. http://m.youtube.com/watch?v=i17g3wPDfa4 
 Denis, thank you for these. I'm loving so many of the forum contributions and references. You've given us a wealth of info and a springboard in just these two comments alone. I'm happily wasting hours perusing the warholstars.org site. It appears AW was comfortable appropriating more than images. He wasn't generous about giving others credit. So much for collaboration, I guess. What a complicated guy. As an aside, it hit me hard to learn that Jed Johnson(Jay's twin) died on TWA flight 800's crash on July 17, 1996 as my best friend also died in that crash. It was a NYC to Paris flight that crashed off Long Island. She was a homicide detective with the Portland(Oregon) Police Department. 45 years old. So sad.",requests,"One of the useful things to think through in relation to 'The Philosophy of Andy Warhol' is whether it reads as a manifesto of some kind. Various artists and artistic movements have written manifestoes - here is one by Claes Oldenburg, for instance. Warhol's book is divided into sections on 'Big Themes': Love, Fame, Work, Time, Art, etc. How are we to understand this book - does it straddle the line between autobiography and manifesto?Thanks, Julia - yes, that quote is on the back of my copy of Warhol's Philosophy: some endorsement! I haven't seen Warhol's book framed as a manifesto, but I wonder whether that would be a provocative or useful way of understanding it. It's probably too long, too anecdotalâ¦ and yet it does contain some of Warhol's most famous pronouncements and carefully crafted aphorisms. What do we require a manifesto to do?
"
137,Attempt to Murder Warhol : Altamont :: Heyday of The Factory : Woodstock,warhol-001,1,"As the idealism of the ""Summer of Love"" (1967) had its culmination at Woodstock (August 1969) and ended with the murder at Altamont (December 1969), so Andy's vision of an artistic utopia, The Factory, was permanently altered by the attempt on his life by an associate (June 1968). In both cases, a certain naivete about the possibility of collective cooperation was permanently lost. Andy's near-death experience made him, once again, a mirror of his culture, but this time in a most unwelcome way. 
Yes, and Andy took it further by making an artwork of a gun like the one that nearly killed him. I don't think many victims of violence would create an artwork based on their personal experience. The gun silkscreen must have been startling to contemporary society, and it certainly made a statement about the commodity and icon status of the gun at that time.",requests,
138,Printing money?,warhol-001,1,"It seems glaringly obvious now, but it never really occurred to me before that by making prints of dollar bills, Warhol was literally printing money. So not only was he appropriating the image and idea of the bill, he was mimicking its production too. The idea of the exposure of the commodification of art as a piece of art you hang on the wall is also really interesting. Art = money/money = art, therefore art is business. 
",elaborates,"Thanks so much for getting the ball rolling on this subject, Kirsty! You're absolutely right: Warhol's screenprints of dollar bills ask us to think about the different between printing/making money, and screenprinting money/making art. You can see one of these works here . One of the notable differences between Warhol's money prints and actual money is that there are gradations of distinction between the individual dollars in Warhol's work - smudges and smears like in some of his celebrity or Death and Disaster paintings - whereas every single dollar is exactly the same. Or is it? We probably need to draw a distinction between the 'dollar bills' works and the 'dollar signs' works, as their relationship to 'actual money' is somewhat different...An excellent reference, Tania - thanks so much for mentioning this book! For those looking for more reading on this topic, we'd also recommend Dirk Boll's 'Art for Sale', and Sarah Thornton's 'Seven Days in the Art World'. We'll be providing reading extracts from some of these texts later this week...
"
