,Title,Course,Task2.1,Post_text,Categories,Instr_text
0,Put the Essays in an e-book,amnhearth-002,1,"During the recent Human Evolution: Past and Present course it was announced that the best of the final essays would be put into an e-book for distribution. While I haven't seen this come out yet it is a great idea. There is so much effort put into studying personal localities across the world I think it would be a fascinating read. It would be a shame for all that information to be in an electronic form but still unreachable. Is this possible?
",resolves,
1,Need help with 'common sense' understanding of probability of earthquakes,amnhearth-002,1,,elaborates,
2,Quiz deadline confusion,amnhearth-002,1,"Today I discovered this course and decided to sign up. The Syllabus and Grading Policy page stated "" You can take each quiz as many times as youâd like. Quizzes will close two weeks after they open, and answers will be available at that time."" However when I went into the Quiz for week one it said the deadline was already past. I can understand having a strict deadline for the peer-reviewed assignment, but why does the page say there are two weeks for the quiz when there seems to be only one week? Or did the course start 2 weeks ago? Please clarify. 
I'd like to know too as I just did the quiz, got 9/10 but it doesn't count because it was 3 hours past the deadline, which I thought was much later on. 
I had same experience...no point in posting my results as it warned that deadline has passed.",resolves,"Hi, everyone. The information on the syllabus was incorrect and I've just changed it. Quizzes are due one week after they open, as indicated on the home page, emails, and individual quizzes. I apologize for the confusion that this has caused. Thanks for bringing this to our attention.Hello Ridwan, unfortunately the deadline for the quizzes cannot be extended. 
"
3,HELP--Anyone with good internet?,amnhearth-002,5,"Hi, I have spent the last three hours trying to download my geology assignment for week 1 (with pictures) to the forum but my internet is too slow for it to work. Does anyone have better internet? Would anyone be able to send me their e-mail address? Would anyone be willing to receive my geology assignment (I can e-mail it to you), and then you can upload it...? Thanks!! 
 I can try for you. When I uploaded mine, it was very tedious uploading pics, it was very sloooow. Did you try uploading text only on first go round, then adding pics after? Anyway my email is kelliec@pacbell.net, what is yours? 
 Hi Michaela It occurs to me that YOU may not be able to earn Signature Track credit for the course if the assignment is uploaded by ME under my user name. I'd still be willing to do it, but this is something to consider. I do know that the pics must be attached individually with the ""Pic"" button in the post box, you cannot upload them as part of another document. Good luck either way 
Hi,I couldn`t finish my geology assignment becouse I was on a trip out of my country.Can I put it on forum in a few next days?I hope the course staff wil give the answer or advice! Thank you.Sorry for bad grammar. 
Hi Branko...the forum is still open...I'm still trying to load pictures :) So I think you are okay....",resolves,
4,It is not my fault that your site can not with hold the load,amnhearth-002,1,Hi - I repeat my request. It is not the short videos that I have to see. It is the sources that you gave and the main video is 88 minutes. This lasted a few days because of internet load. I am new in this field and I have to study all the material that you ask to study. I am doing it around the clock. I enclose the result of my quiz and it is very disappointing that you cant delay the time of doing the quiz. Please check in other courses and you'll find that there are courses with no time limit. What does it mean to you that time is passed? Are doing something with the results of the quiz so early in the course? It is the same result if you delay the time out. In any case student who started late are losing the chance to certificate. This is not the best solution from marketing point of view. zvika greenberg Haifa Israel,resolves,
5,Can someone clarify the issue of sulfur esp as it appeared in the Quiz,amnhearth-002,1,"Can someone point me to a resource or send info re the question of sulfur and sulfur dioxide which appeared in Quiz 2 thanks 
It was discussed in this essay: Origin of Earth's Atmosphere - By Drs. Ed Mathez and Ro Kinzler https://class.coursera.org/amnhearth-002/wiki/view?page=origin_earth_atmosphere ""independent evidence suggests that much of the sulfur has been recycled from Earthâs surface back into the mantle, which would account for the lower amount of SO2 in the present surface reservoirs than in volcanic gases."" 
Elayne Here is a link to a science article about the process: http://www.sci-news.com/geology/article01037.html There is a link in the article to the study.",resolves,
6,This week it was not possible to cope with the material,amnhearth-002,1,Hi - I am trying to read and see all the material you are asking us to do. There was a video of 88 minutes. This video was not accessible. The internet pace could not hold the amount of students in this course and it took me hours to see all the video. The same happened with the other videos. This course work is too much. Assignment + Quiz. I am doing step by step and I came late to do the quiz. I think the course is wonderful and I'll try keep on although the conditions can't allow me to cope with the material. I'd like the management of this course to be more flexible about date of work. And give us a little more time space to fulfill the mission. You are dealing with billions of years and suddenly you are standing on the minute. To be a real geology man you have to be equipped with larger time scale. zvika greenberg Haifa Israel,social,
7,where to post the 2nd part of the assignment?,amnhearth-002,"1,2.","please direct me to the place to post the essay part of the assignment. Does it go along w the pictures? Do I repost my pictures or post the essay under the pictures? 
The Assignment link is on the left side toolbar. Click the Assignment button to open the submission page. Your material can be typed directly into the box or copied from a word processing program Include a like to your Assignment #1 Forum Post at the top of Assignment # 2. 
Typo ""link""...not like!",resolves,
8,The Mantle is not stable it has mental problems,amnhearth-002,1,"Hi - I played with some numbers. Please check me. I know the radius of earth = 6,400 km, frequency of rotation 1 rotation every 24 hours. From here I can calculate the earth acceleration because of rotation. R1=6,400 km =6.4*10^(6) m, f1=1 cycles/24 hours. acceleration = a = R1*W1^2 W1=2*Pi*f1 f1=1/24*3,600=1/86,400 = 1.16*10^(-5) 1/sec W1= 1.16*10^(-5) 1/sec*6.28=8.45*10^(-5) 1/sec W1^2=(8.45*10^(-5) 1/sec)^2=71*10^(-10) 1/(sec^2) a1=(6.4*10^(6) m)*(71*10^(-10) 1/(sec^2))=454*10^(-4)m/(sec^2) I know the radius of earth orbit = 150 *10^6 km=150*10^9 m frequency of rotation 1 rotation every 365 days from here I can calculate the earth orbit acceleration = 54*10^(-4)(m/(sec^2) OK Now I can see that on the poles there is only the orbit acceleration. In the equator inner side close to the sun there is 454-54=400 *10^(-4)(m/(sec^2) In the equator outer side apart from the sun there is 454+54=108*10^(-4)(m/(sec^2) OK Now look what is happening - On the poles there is a vertical gravitational force of 9.8 m/(sec^2) but perpendicular to this force there is the orbit acceleration at 54*10^(-4)(m/(sec^2) If you combine this 2 vectors you get a shift which is away from the sun. It means that if you drop a body on the poles it does not fall vertical but a little shift away from the sun. The rest calculation on the equator is obvious. Why that calculation for? Now think what will happen to miserable mantle flow who is looking for the poles - will he miss the target? This mantle will be very unstable and confused. zvika greenberg Haifa Israel",elaborates,
9,Student Misconceptions - Lecture 3.7 - The Mantle is not Liquid,amnhearth-002,1,"Hi - I am one of those who thought that the mantle is really liquid. It is because I thought that there is a volcano eruption what comes out of it is liquid magma. I thought that it comes from the mantle therefore the mantle it liquid. Now I have to understand that it comes from deeper places on earth. If mantle is not liquid - how do you differentiate between crust and mantle? zvika greenberg Haifa Israel
",resolves,
10,Crust shortening?,amnhearth-002,1,"What is the physical orientation of crust shortening: Is it a shortening of the horizontal or vertical distance (length or thickness)? 
",elaborates,
11,Sorry for stupid question,bioinfomethods1-001,1,"Sorry ,but I don't uderstand your actions on 26 slide.can someone explain me please.
I'm afraid the video was recorded some time ago, http://www.ncbi.nlm.nih.gov/gquery does not look like this anymore (slide 24).  But you can still find a link to OMIM (slide 26): http://www.ncbi.nlm.nih.gov/omim/?term=early+onset+breastcancer Here I also could not find the link leading to ""Geneview in dbSNP"" next to the entry. Can anyone post where this linke is located now or post the URL of slide 27? Thanks for your help!",resolves,
12,Slide 22,bioinfomethods1-001,1,"It would be nice if the slides for the lectures were available. I have been watching the Week 1 Lecture.  I could have easily written a lecture for the part about database concepts.  I am familiar with most of the rest of it, but I seem to really be missing some minor point on slide 22 regarding alpha and beta globin chains.  I went back and listened again and it still does not make any sense to me.  Perhaps it will as I finish watching the video.",elaborates,"I believe that slide 22 related to briefly explaining the evolutionary relationships between genes related by sequence similarity, and a quick explanation of the various terms used to describe these relationships: homolog, ortholog and paralog. Paralog refers to duplicate copies of a gene in the genome of a species, in this case the mouse alpha globin chain gene and mouse beta globin chain gene can be thought of as paralogs of one another. Orthologs are genes that occurred due to speciation, so after the early globin chain gene duplicated into alpha chain and beta chain globin genes, the genes were found in different species. In this case, mouse, frog and chick alpha chain globin genes are orthologs of each other. Homolog is the all-encompassing term used to describe paralogs and orthologs. I've added the slides as a .pdf file (link is beside the mini-lecture link on the Navigator page), Arleigh."
13,Why is there no mention to Muscle allignment software?,bioinfomethods1-001,1," I think, not sure, that Muscle is so popular MSA application as Clustal. Am I wrong? Why is there no mention to Muscle?  
",resolves,
14,Evolutionary history,bioinfomethods1-001,1,"I am confused about the evolutionary history of the 8 sequences shown on page 1 of the lecture notes. In the video Dr. Provart states that ""the top 4 sequences are more similar in terms of their alignment than the bottom 4 sequences, which are also aligned in the sense that there is an insertion in the 2nd set of 4 sequences down here. So these (the bottom 4) are likely more closely evolutionarily related than these (top) 4 sequences and this can tell us the evolutionary history of a set of sequences that have been aligned."" Can you explain why this is? I would think that closer sequence alignment would indicate closer evolutionary history among the sequences.",resolves,"I think what is meant here is that the bottom 4 sequences are closely evolutionarily related to each other, and the top 4 sequences are closely related evolutionarily to each other. This is due to the fact that they align in a more similar manner to each other. Yes, that's what I meant. We'll see this better when we use multiple sequence alignments to construct phylogenetic trees next week! Best, Nick"
15,Regarding Bioinformatic Methods I,bioinfomethods1-001,1,"I would like to thank all my peers for providing excellent explanation on bioinformatic methods. The course / lab exercises /quiz are really innovative and informative. Links are very useful to download tools. But, I encountered  difficulty while using MEGA software as I cannot import file for further analysis. Do explain clearly about file conversion for eg. Fast A format to other versions that are required by MEGA software. Thank you.
",requests,"Hi! At which stage are you having problems with the file? Did you right-click on the link and save as? You should not open it using the link, but instead save it directly. Also, the extension of the file should be "".fas"" not "".fas.txt"". 
"
16,Pseudo-replicate construction,bioinfomethods1-001,1,"I'm getting lost during the explanation of how pseudo-replicates are constructed, slide 28, 21:50 ""...where you can see that weÂ´ve sampled the first column once, the second column three times..."" When looking at these columns, I am not sure what one sampling, or two etc should actually look like. As well, what defines the max number of samples you would take for any column?
Same problem",resolves,"Bootstrapping is a way of assigning confidence to a tree. Pseudoreplicates are created through an iterative resampling process. If you have a dataset (set of sequences in this case) of n sequences with m sites (bases or nucleotides), a number of resampled datasets are produced, and each site is sampled at random a number of times. These resampled datasets are used to produce a number of trees which are then all reconciled in order to produce one tree with confidence/bootstrap scores included. Generally, a good number of bootstraps is 500 - 1000 (depending on the time and computing power and size of dataset). A link that may help explain this further is: http://www.icp.ucl.ac.be/~opperd/private/bootstrap.html Hope this helps explain the concept further! Hi Eduard! See my post above for (hopefully) a bit more clarification. Many different random sampling patterns would be constructed, each containing the same sum as the length of the sequences. Eventually, after many runs of this process (500 in your case), you will be able to gain a statistical confidence for your tree."
17,parsimony vs ml,bioinfomethods1-001,1,"Any clear advantage in using ml vs parsimony? Would there be a situation where parsimony would be better?
Thanks for the reference at the end of lab 4. S Guidon and O Gascuel (2003) A simple, fast, and accurate algorithm to estimate large phylogenies by maximum likelihood. Syst. Biol. 52: 696-704.",resolves,
18,Can 3 branches arise from a single node?,bioinfomethods1-001,1,"In Max. likelihood example in the lecture at j th position, i noticed trifurcation, however if the ancestral node is either C or T, then don't we need an internal node of A or G for the terminal nodes A and G and compute likelihood at these internal positions also?
",resolves,
19,Erroneous and misleading information about Synonymous SNPs (sSNPs).,bioinfomethods1-001,1,"Sorry I'm late, but I've started the course just 3 days ago. Eventhough it already has a post relating this, it does not really seems to put the attention that this subject deserves. In lecture slides page 6: ""Synonymous substitutions are not exposed..."" I suggest that this information has to be changed. According to Chen (2010) (DOI:10.1371/journal.pone.0013574) sSNPs are just as likely to be involved in disease mechanisms. The reason of this is really well explained in a Nature paper of 2011 by Sauna and Kimchi-Sarfaty (DOI:10.1038/nrg3051) where they describe 4 different reasons why exactly sSNPs might be as damaging as the nsSNPs. (short link for the paper: http://goo.gl/CFy1Sf , reasons really well summarized on page 686 Figure 1). Therefore, nowadays, to stating that ""Synonymous substitutions are not exposed to (strong) selective pressures since they donât result in a change to the protein sequence"" and to suggest that this type of method would bring a more reliable result, would be as we Brazilians call: ""a shot in the foot"".",resolves,
20,Sign of Selection,bioinfomethods1-001,1,"Hi, all. I'll just post some quots from the lecture5. > ""Positive (âDarwinianâ) selection occurs when a beneficial mutation occurs in a population and increases in frequency (e.g. antibiotic resistance)"" > ""Positive selection effectively sweeps genetic variation from a population"" > ""In the case of positive selection, you would expect to see a higher proportion of amino acid substitutions in your population (because they are being increased by positive selection)"" I can see certain inconsistency or even contradiction here. Clarification required.",resolves,
21,Pi and Theta?,bioinfomethods1-001,1,"I just started watching the week 5 lecture, and I have to wonder why a population geneticist would consider using theta and pi as something other than a representation of ""degrees"" and ""the  ratio of a circle's circumference to its diameter "". What goes into someone's thinking in choosing the representation of a parameter/variable?",resolves,
22,When in relation to the three types of sections does non-synonymous/ synonymous mutations occur,bioinfomethods1-001,3,"Is it write to argue that synonymous mutations may only occur in a balancing selection whilst, non-synonymous mutations only occur in +ve or -ve selections? 
Organisms tend to use some codons more than others, and other organisms prefer different ones, even if they code for the same amino acid.This is known as codon bias.So, even synonymous changes can be under (weaker) selective pressure. Also, a non-synonymous mutation could have little to no impact on fitness, but might increase in frequency due to random drift. 
=""Is it write to argue that synonymous mutations may only occur in a balancing selection"" If I understood question correctly - no, it's not right. Synonymous mutations occur constantly, because they are under almost zero selection pressure. 
The effects of changing to synonymous codons might be subtle, but it seems they aren't insignificant: see e.g.  http://www.ncbi.nlm.nih.gov/pubmed/21102527 http://www.ncbi.nlm.nih.gov/pubmed/18983258 http://www.ncbi.nlm.nih.gov/pubmed/20308095 http://www.ncbi.nlm.nih.gov/pubmed/9720271",resolves,
23,Metagenomics,bioinfomethods1-001,1,"Just wanted to say that this is my first exposure to metagenomics, and, mind blown. That is all. :-)
",social,
24,DNA fragments for sequencing in slide11,bioinfomethods1-001,1,"Hi Folks, Can, please, someone help me to understand a picture in slide 10 (wrong in the name of the thread), Lecture 6 [=box1 (lab6)]. It shows that the primers at 5' end of the top strand are always green and at 5'-end of the reverse strand are always red. So ligation is unidirectional. Is it just simplification to make it easier for students to understand? Or is it really so? Then my question is how is it done. Any comment will be appreciated.",elaborates,
25,Information lost in lecture 6 slide 5 in pdf,bioinfomethods1-001,1,"I have submitted a bug report and replicate it here just in case: The figure on a slide 5 of a lecture 6 (about costs of human gut microbiome sequenced by Sanger, Roche 454 & Illumina) is 2 tables with rows and columns appearing sequentially while lecturer is discussing corresponding technique. However, in slides PDF only Sanger-related row and column (first ones) are present.",resolves,
26,Week 6 video lecture?,bioinfomethods1-001,1,"It seems there is no video of week 6 lecture?
Same problem, it's not just you 
I can't see the video of week 6 lecture.",resolves,
27,online experience (jax.org) does not match week 2 lab,bioinfomethods1-001,1,"#1 After following the instructions for finding pax6 gene in informatics.jax.org, I don't see: Thin diagonal blue lines in the bottom panel represent orthologous genes between mouse and human.  #2 I landed in: Chromosome 2: 105,183,133-106,183,132 and not the range indicated in the lab pdf. So the lab questions didn't apply to the page I was observing, but I think I get the gist of what they're getting at by inspecting the pdf.",resolves,"If you clicked on the Pax6 results when you used the Quick Search, the ENSEMBL link will take you to the region specified in the lab. Did you add Human for region comparison? I get this result (today) but I'm no longer seeing the blue lines as described in the lab. Not sure why. However, the green parallegrams connecting the human and mouse regions that are similar are still useful and you can still see the synteny, Gary, see  http://uswest.ensembl.org/Mus_musculus/Location/Multi?db=core;g=ENSMUSG00000027168;r=2:105183133-106183132;r1=11:31324981-32324980:-1;s1=Homo_sapiens . There was an update to the ENSEMBL DB between the time I posted the lab and now :( Best, NickYes, I'm learning about these issues as we move through the course, Laura! Sorry for the glitches... Best, Nick"
28,Gene Order and Coding Strand,bioinfomethods1-001,1,"In the lab we compared human and mouse pax6 and the purpose of it is to show us that gene order is often conserved. However, I have a question about the coding strain. In mouse it is on the forward while in human it is reverse. How can the order of genes conserve while the coding strand is not?",resolves,
29,Can't see the blue diagonals lines connecting orthologous genes,bioinfomethods1-001,5,"If you can`t see the blue diagonals lines connecting orthologous genes as happened to me , click on Configure this page or on Select species or regions on the left pannel. In the pop-up window, click on the tab Configure Comparison Image (the first tab) and under Comparative features select join genes. If after all this you still can't see the lines, refresh the page. It should work. Hope it helps! 
Thanks! 
Thanks ! :) 
Thanks
I can see only one blue line?? 
Thanks!
",resolves,
30,BLAST or megaBLAST,bioinfomethods1-001,1,"Hello everyone.  Does anyone know the difference between BLAST and megaBLAST?  I found the description here: http://www.ncbi.nlm.nih.gov/blast/html/megablast.html It seems it handles longer sequences more efficiently than BLAST.  When would you use one search versus the other?  Thanks in advance.
",resolves,
31,How about an office hour or working session at UofT?,bioinfomethods1-001,1,"A few of the other courses on coursera had offered in-person sessions for students lucky enough to be close to the schools offering the course. I think this is one of the first UofT courses since Neural Networks in 2012. Might you be inclined to hold a local meetup Dr. Provart?  
crickets",resolves,
32,What matrix to use and when?,bioinfomethods1-001,1,"Hi, all. I re-read the lecture and the lab 2 and also read some help about BLAST, and still I don't understand what substitution matrix (PAM or BLOSUM) and with what number we are supposed to use. Well, with number I've the 'half-answer' - if we know the approximate similarity (or evolutionary distance) between compared (aligned) proteins, we can choose. But if we are searching for the homologs of some protein across database, how we select the matrix?",elaborates,"Hi Boris! Generally speaking, PAM matrices are better to use for global alignments while BLOSUM matrices are better to use for local alignments. In terms of numbers, PAM100 would be used for less divergent sequences while PAM250 would be used for more divergent sequences. Confusingly, BLOSUM90 might be used for less divergent sequences while BLOSUM45 may be used for more divergent sequences. This resource may help you a little: http://abc.cbi.pku.edu.cn/2can/tutorials/matrices.html If you go through the Week Navigator, they are available to download if you right-click and save the file where it says ""these sequences""."
33,Week 2 Discussion vs. Item 15 of the Lab. Taxonomy report,bioinfomethods1-001,1,"Why my result came up with 1,916 while our instructor's result was 1,914 in the video Week 2 Discussion at 03:50. Other things' results came up the same, just except that one. Did I do something wrong?! Please help/explain. Thanks. Please see my result in the snapshot below",resolves,
