,Title,Course,Task2.1,Post_text,Categories,Instr_text
144,Are Warhol's films less Pop Art than Abstract Expressionism?,warhol-001,1,"Thinking about this week's theme of 'Time', I'm interested in how the different parts of Warhol's work fit together (or don't), and how they fit in with what's going on around them. To me, Pop Art is about speed and the 'instant' - instantly recognisable images, often of things that go faster, that save time or that don't last. The films, however, seem to be the opposite of that, using real time or even slowing down time. Do Warhol's films of the Factory Superstars actually have a movement and subconscious expressionism that shares something with the Action Painting of Jackson Pollock? Do films like 'Sleep' and 'Empire' have more in common with a Rothko than a screenprinted Marilyn? We know that Warhol started out his fine art career experimenting with Abstract Expressionism in his painting, but abandoned it in favour of the Pop Art style he was better at. Maybe his Abstract Expressionist sensibilities come out (unconsciously?) in his films? Would love to hear other people's thoughts about this!
If you need to associate them with a movement, hyperrealism perhaps? I'd suggest that perhaps the films are like the screenprints in that they're about what's on the surface, they're deliberately not looking deeper. Disengaged like the Death & Disaster series. Devoid of comment almost. p.s. I used to live in Abernethy, left when I was 5 though and I'm old
Thanks for these really useful links - the discussion on boredom in the Haladyn article is particularly illuminating for this week's topic, I've bookmarked it to read again. I'm aware I'm getting dangerously out of my territory here, but I was interested that Squibb takes as a given that Warhol 'rejects' Abstract Expressionism. From what I have read about this (which, I'll be honest, is limited), Warhol does not appear to reject it in the way, say, Rauschenberg and Johns do, but rather turns his back on it for something that fits him a little better. This may turn into a rejection over time, but it could also just be an absence. I hadn't thought about the collaborations with Basquiat in this way, but maybe they do help demonstrate that Andy and Expressionism weren't mutually exclusive! I'm glad I started this thread, it's helping me tease out a lot of thoughts about the subject - even if I am losing the argument :-).In the film of Glyn Davis, it was posited that the long films are a way of the artist saying that my time is not your time. I believe this is another way of saying that my art is not your art -- my art is conceptual, your art is Thomas Kinkade. As art became more conceptual, it also became more divorced from the general public.
There's a thread somewhere where people discuss what celebrities Warhol would be screenprinting today were he still alive. I wonder which way his work might have gone - whether more conceptual & Turner prize-ish or just producing Marilyn-type screenprints as vanity projects for wealthy celebrities. Is Warhol's time not our time partly because he changed the frame rate of the films? In https://www.youtube.com/watch?v=ObhNiJaoVow , the subject of Sleep says that Warhol got the idea for the film when he was on speed, his perception of time maybe distorted? On the same YouTube film, Warhol's brother says that, when he said he was going to watch one of his movies, Andy advised him to give him his 3 dollars, he'd boot him in the rear end, don't waste your time.",elaborates,"Thanks so much for starting this thread, Allie - this is a really fascinating discussion. And Sandra, thanks for posting the links to those two articles, which are both excellent. A thought about the categorisation of Warhol's films: in addition to categorising them in relation to fine art movements, we can also try and understand them in relation to film movements. For example, Warhol's early, silent experiments with film duration are often discussed in relation to structural film. In the Structural Film Anthology , Peter Gidal provides a really useful introduction to structural film, which you can read some of here . Crucially, he claims that structural film has links to, or similarities with, two fine art movements: abstract expressionism and minimalism. One of the defining characteristics of structural film is that it investigates film as film: the basic components of the medium. Could the same be said of abstract expressionism and painting?Something else we can think about here is the issue of ""wallpaper"", which came up earlier in this thread. A previous post likened Warhol's long films to wallpaper, in that they operate in the background and are not meant to totally entrance the viewer. Greenberg also famously celebrated Pollock's drip paintings for their all-over and radical ""wallpaper"" effect, in that they don't seem to necessarily finish at the edge of the canvas. Is there any way we can use this theme - wallpaper - to perhaps differentiate Warhol's films from Pollock and ab ex, or find any unexpected similarities? 
"
145,Art of Norman Rockwell and the shifting fortunes of time and money,warhol-001,1,"This is an interesting article which links our themes of Time and Money. Rockwell's art was out of fashion, and looked down on by the critics, for decades. But since 9/11 his popularity has soared and anyone who bought his paintings in the 20th century has probably made a very lucrative profit. The article compares him to Warhol, in terms of re-evalution and consequent sales. http://www.nytimes.com/2014/05/24/business/norman-rockwell-captures-the-art-markets-eye.html?ref=todayspapersting 
Thanks for the link- and a little personal vindication. As a child, I vividly remember studying Rockwell's covers on the Saturday Evening Post magazines, and loving them. I was a lttle disappointed in my critical abilities when, as an adult, I was told they were not really considered art.
Maybe Warhol and the other Pop Artists helped break down our ideas about what is ""real art"" and what is not.",elaborates,
146,Boredom Repetition and Meaning,warhol-001,1,"I think boredom is a theme that can be found throughout Warhol's body of work. It's in the way he uses repetition. There is a point at which the object (the Empire State Building in the film, the electric chair, the can of soup) loses meaning as an object, and that lets you see it, and the art, in different ways. I think it's especially interesting to notice how you relate differently to the work once you've crossed this threshold. 
I think what you describe and definitely Warhol does is similar to Automatic Writing that writers used to do a century ago. To try to connect with your deepest feelings. The work of art should come from the soul and not the mind. The unconscious that Freud describes as the ""id"" that is the set of uncoordinated instinctual trends. 
I hadn't thought of automatic writing, but yes, absolutely. I don't think the mind disengages completely with Warhol's repetition. Rather, with the loss of meaning comes new meaning, you see the form rather than the function of the object. Yes, you got a good point ther because meaning cannot be constructed without the active participation of the mind. But on the other hand, Warhol said ""I want to be a machine"". There is some confusion to that; Warhol wanted actually to be the machine that is stripped of a conscious mind? What did a machine symbolise to him? Only the repetition pattern? What do you think?
I think this is part of it. He is, in a way, taking his agency out of his artwork, stripping his meaning out, but this makes the viewer's agency stronger. In the end, it is us, standing before light colored repetitions of the electric chair, dollar signs or soup cans, who will first lose their meaning and relationship to the real world object, and be forced into new meanings and new ways of seeing. I'm not sure this was what Warhol wanted to do, but he was more aware than many artists of the effects his work had on the audience. I just viewed the 24 hour live webcams established between EarthCam, The Andy Warhol Museum and St. John Chrysostom Byzantine Catholic Church in Pittsburgh, and I am left a bit speechless. It is past 10:00PM here in Siem Reap, Cambodia, yet I was allowed almost by magic to hear car traffic unlike any I have heard in over a decade and listen to tiny birds chirp as I viewed three Campbell's soup cans atop and little American flags wave near Andy Warhol's grave at what I imagine is 11:00AM on a normal Monday morning in May in Pennsylvania. Then I viewed the live feed set up within the very church a young Andy Warhol would sit with his devout mother sometimes for as long as eight hours and I saw the same iconostasis that Warhol would sit and stare at for hours on end. I can now easily understand how all of the artistic themes explored in Warhol's works have their roots in the repetitive rituals of his childhood. The music was peaceful and eeery. If you have not visited this website, be prepared for subtlety, contemplation, and the infinite luxury of boredom. I am going back tomorrow during my four hour long lunch break to contemplate Warhol's Last Supper Dove and the final writing assignment for this my delightful first MOOC experience. 
 http://www.earthcam.com/usa/pennsylvania/pittsburgh/warhol/",elaborates,"Some great posts and comments on this page - please keep them coming! Sabina's post, which opened this thread, refers to a point in the consumption of an artwork featuring repetition at which perception shifts. I am reminded of the film director Andrei Tarkovsky's comments on film and boredom. He said, in relation to editing, that 'If you extend the normal length of a shot, first you get bored; but if you extend it further still you become interested in it; and if you extend it even more a new quality, a new intensity of attention is born.' Do you agree with Tarkovsky's argument?Kirsten, thanks so much for this observation, which is fascinating. I'm reminded of other films - especially by 'structural film' directors - which also explore atmosphere, wind movement, light shifting, etc. James Benning's films make for a valuable comparison: his 'Ten Skies' features ten lengthy shots, each about ten minutes long, of clouds drifting; his film 'Ruhr' contains lengthy static shots of industrial buildings. I think the interesting question your post raises is how effectively painting and film, as distinct media, can be used to capture things like shifting environmental factors...
"
147,Can you watch the Empire State for 8 hours ?,warhol-001,1,"Warhol ""played"" with time perception and the different reactions to the film. IÂ´m sure some of the viewers may have thought they were losing their time:)
I think that Empire would be perfect shown on a white wall at a cocktail party-- i.e. don't sit in a chair in front of it and watch it, but refer to it again and again as as beautiful backdrop to what ever is going on in the lives of those around it. This would be especially effective if done in a desert or in an equally rural or remote location. I think Andy would approve of any use of his artwork, if it gave pleasure to some AND they paid a fee for viewing.
I like your idea, and nice remark for the fee. :) In the first week's reading, it was said that Andy didn't even sit still for three minutes to make those Screen Tests , so I really doubt if he himself ever intended to play and watch all those ""Still Movies."" To be honest, no; I could not watch it for eight hours. It was creative, but who could maintain their interest for so many hours?
well regardless if they were or not losing their time we do have to agree that watching it for eight hours can be painful :-) 
Not really, but I really appreciate the play with time and perception (what is important to Warhol) that the film generates.
Even Glyn says u might get bored u might fall asleep in the video :-) 
",elaborates,"Another forum poster described it as a 'wallpaper film', which is a wonderful way to think about its background quality. I think you're right, put the film on in the background and allow your attention to wander. Although, we spend so much time with films/tv nowadays. I mean, I can waste hours in front of a good box set! Perhaps our attitudes to time and film have changed substantially? Sorry Alberto, I should have been clearer! I wasn't suggesting that the two are the same, just that we are much more used to spending long periods of time in front of a screen now, and I think we forget that the experience would have been very different for a viewer fifty years ago. 
"
148,Empire: About the title,warhol-001,1,"I couldn't help but to think about the title ""Empire"" and its relation to the long, expanded ""temporality"" of the film. I wonder if Warhol didn't pick up the building as a symbol of the political role the USA had in that time (in a Cold War context) and created such a long film to stress the status quo of the American society. The course didn't actually directly approached Warhol's works from a historical point of view. I think we could use this space to discuss it a little bit. 
",resolves,
149,Screen Tests....Really?,warhol-001,1,"After viewing the first weeks lectures, I was curious about the screen tests done by Warhol. So...of course, I found them on YouTube.com. Initial reaction: huh??? Had Warhol just used the video footage of his subjects? or did he really put it all together as viewed on YouTube ( http://youtu.be/M--oHOn4a0U ). This is a compelling question...as if indeed, he put the entire three min. video together with the shots of Bob Dylan in The Factory, the music in the clip, and the bored video clip of Dylan, then I would view this as a documentary of Bob Dylan and in that regard, yes, Warhol as a film artist. I also viewed another film test ( http://youtu.be/f9Lhxnlri-4 ) from the MacKenzie Art Gallery's homage to Warhol's screen tests with a side note that it was only a re-creation. My question now is: why did Warhols original screen tests need to be more than a minute at most? With the subject not changing at all during a three minute video, was there more to gather after just a minute? The last film test I viewed was of Nico ( http://youtu.be/exFokKr-WEg ). This one was a little more interesting...she plays with her hair, picks up a magazine, turns it into a telescope, even smiles at the gesture...and I admit, I gave a little laugh as well. In general though, his subjects look quisitive, puzzled, scrutinizing, bored, and their facial expressions often seem to question ""what the hell am I doing here?"". Curiously enough...I long to watch more. Perhaps that is the realization of Warhol as an artist...great ones always leave you wanting/anticipating more. 
Try watching Sleep or the film of the Empire State Building, then. ;) I went to a screening of the screen tests at the Museum of Fine Arts Houston several years ago and am proud to admit that I was one of the few people who managed to sit through the whole thing. Most walked out, of course, which is understandable. I'm sure I at least nodded off a few times. If you found some on YouTube with music, though, I'm fairly certain that was added as everything that Warhol recorded was silent in the case of the screen tests. In regards to another thread, I think the screen tests may be the closest Warhol ever got to an actual ""critique"" of celebrity. Of course, screen tests are a real thing and were actively used by Hollywood in the ""golden age"" and beyond to judge how actors and actresses could portray certain emotions, etc. So for Warhol to engage in the same sort of activity but instead with his Superstars and others from the art world and underground scene forms a sort of commentary about who and what was allowed to become famous.
I actually did see Sleep (or part of it I should say!) at the museum in Pittsburgh. zzzzzzzzzzzzz....lol Agreed on the critique of the celebrities...in an usual sort of way. In the end, he did achieve his dream of wanting to be famous. It's all about the journey : ) The screen tests were all actually silent.Musicians Britta and Dean were commissioned to do a soundtrack for ten of the screen tests which is available on DVD. I find them mesmerising and quite hypnotic. The length of the test was due to the size of the film reel that Andy was using. Warhol often filmed things in a static way...like his film of the mpire State Building - which I believe is around 8 hours long. 
Lisa-I am puzzled by the screen tests as well. One thing that surprises me is the willingness of the subjects to just sit there. I wonder how Warhol convinced them to do it and what the subjects thought the purpose was.It comes across as a mutual admiration society-Warhol was fascinated by his subjects and the subjects were fascinated by Warhol. 
They were projected at a slower speed than what they were filmed at, so the subject was actually sitting for less time that what you see in the screen test. I find them quite mesmerising too, but see them as portraits rather than what we think of as screen tests. 
Like how nobody just posts photos on facebook anymore, it's all GIFs and short video. Maybe, like Kirsty says, think of the screen tests as non-static portrait photographs. Who says a portait has to be static, afterall? And it's not like portrait photography or painting always captures the sitter doing something interesting, they're usually just... sitting! I love watching Warhol's screen tests. Just saw a few at a gallery in Las Vegas this year. It seems it was a required ritual every time a new person visited the factory. I thought to myself, if it were me, and I was directed by Warhol to just sit and look at the camera for a couple of minutes before I could enter the party going on, what would I do? It was interesting to watch how comfortable some were, versus how self conscious others were. Plus, these extended portraits give you a great idea of how a person would look on film, and some great insights into the personalities. 
'Screen test' can maybe be read in two different ways - the traditional test to test an actor or lighting etc or, in this case, a test of the people being filmed and put under extended scrutiny for the screen. One minute of filming might feel quite comfortable for the subjects, by extending it more of them will be taken out of their comfort zone. With the screen tests of celebrities in particular, focusing on their moving faces for more than a few moments can make the viewer look at and see them differently - making them seem more 'human' than the 'icons' we thought of them as before. So Warhol both creates celebrities and makes them more like us again.
Yes, the screen tests let you see the ""aura"" of the subjects.Its hard not to see some of these screen tests as anything other than people just posing. I find watching people intriguing, but some of them just seem so put on. Nico- such a beautiful girl- but is it that intriguing? Shes just posing and looking around. Is there more to it im not seeing?
I think the screen tests are brilliant. They are about ""the gaze"" and looking. I mean what is visual art about if not looking. The screen tests are also about getting behind the masks that all people wear and probably especially celebrities. And we know that Andy wore his Andy suit and he was in many ways a facade. But having the camera on the sitter with the sitter having no purpose really but to sit and look at it causes the person to react. When the viewer's eyes meet the subjects eyes, i feel we somehow feel voyeuristic...like we are peeping into a show where we are taking something from the subject against their will. Also, their are comparisons to be made between the screen test and the traditional practice of sitters ""sitting to"" an artist, and in many cases this was a strenuous and stressful process. There is something very disturbing, too, about the screen tests. It is that looking at them now.....with the subjects being either dead or old (Sedgwick and Dylan), the passing of time and the fleeting nature of human life, of our life is more poignant. And I find them rather dramatic. The screen tests offer many points of entry for the viewer and lots to ponder and take away. I like them very much. 
Many screen tests show a diversity of behavior models pictures, but surprisingly little improvisation. The models actually seem to have been caught and about to be interrogated, but the question is never . 
Screen tests use the concept of repetition to make people seem boring and ordinary. In my understanding, Warhol was all about making everything seem tangible. Screen tests appear to be an extension of this.",elaborates,
150,Anthony d'Offay Interview,warhol-001,1,"This was really fascinating - thanks for posting. For me it was really interesting to get an insight into how Warhol worked with dealers/gallerists. I was quite surprised that he asked d'Offay what it was he wanted, then less surprised when he subverted that to what worked for him and what ultimately worked for d'Offay too. A great anecdote!
",social,"Thanks, Victoria - really glad you enjoyed the video! There's much more Anthony d'Offay to come next week - this video acts as a kind of teaser. Good point. In fact, many contemporary artists have teams of assistants and makers working for them to help in the fabrication of their art, but this is rarely discussed. The reputation of so many artists relies on the unseen (and often unacknowledged) labour of a group of employees. But does this matter? Is it the idea - rather than its execution - which is of importance? 
"
151,Andy's Alternative Cinema,warhol-001,1," Of course we call Andy's filmmaking alternate. But that almost doesn't put a fine enough point on it. The history of media is the repeating story of wild, game changing, Utopian dreaming, innovation, that is colonized and domesticated to... well... to present the banal culture Andy celebrated in the pursuit of selling the products he immortalized: Coca Cola, Soap, etc. About already enslaved media like Radio, Film & Television we can ponder ""what if?"" About The Internet, currently under the lash, but not yet completely domesticated, we can battle over Net Neutrality. Andy may have idolized celebrity, but his filmmaking was about as un-Hollywood as one can imagine. What would our world, our media, and our culture be like in some alternate reality where ""Hollywood Filmmaking"" never really took hold, and style was dominated by ""Warhol Filmmaking""? When I look back at the Screen Tests of half a century ago I see Andy prefiguring aesthetic pursuits ranging from Bill Viola's oeuvre to Marina Abramovic's The Artist is Present. We often think of Andy as pop superficiality, yet the Screen Tests offer an intensity of lived presence that Hollywood Filmmaking doesn't dare consider. 
",elaborates,"Thanks, Edie. This is a really interesting argument. But I think we need to acknowledge that Warhol was in thrall to Hollywood. And I wonder to what extent we can only understand his cinema as a riposte or challenge to the norms that had been established by Hollywood?Well, it's certainly true that his films were often collaborative ventures - with particular writers (Chuck Wein, Ronald Tavel), for instance. But Warhol was responsible for making almost all of his films. Only towards the end of his productive period of filmmaking - around 1967-8 - did he start to entrust direction to Paul Morrissey, who had been working with him on his films for a while by that point. If you can remember where you heard that other artists had a hand in Warhol's films, we could work through those claims in this thread!"
